{
  "$schema": "https://json-schema.org/draft/2020-12/schema",
  "$id": "veil:case",
  "title": "Case",
  "type": "object",
  "additionalProperties": false,
  "required": ["id", "title", "difficulty"],
  "properties": {
    "id":          { "type": "string", "pattern": "^[a-z0-9_]+$" },
    "title":       { "type": "string", "minLength": 1 },
    "description": { "type": "string" },
    "difficulty":  { "type": "integer", "minimum": 1, "maximum": 10 },
    "status":      { "type": "string", "enum": ["available", "active", "solved", "failed"] },
    "entity":      { "type": "string", "pattern": "^[a-z0-9_]+$" },
    "locations":   { "type": "array", "items": { "type": "string", "pattern": "^[a-z0-9_]+$" } },
    "npcs":        { "type": "array", "items": { "type": "string", "pattern": "^[a-z0-9_]+$" } },
    "clues":       { "type": "array", "items": { "type": "string", "pattern": "^[a-z0-9_]+$" } },
    "quests": {
      "type": "array",
      "items": {
        "type": "object",
        "additionalProperties": false,
        "required": ["id", "title"],
        "properties": {
          "id":        { "type": "string", "pattern": "^[a-z0-9_]+$" },
          "title":     { "type": "string" },
          "description":{ "type": "string" },
          "objective": { "type": "string" }
        }
      }
    },
    "extra": { "type": "object" }
  }
}
